{"$schema": "http://json-schema.org/schema#", "type": "object", "properties": {"link": {"type": "array", "items": {"type": "object", "properties": {"rel": {"type": "string"}, "href": {"type": "string"}}, "required": ["href", "rel"]}}, "id": {"type": "string"}, "channelId": {"type": "string"}, "title": {"type": "string"}, "author": {"type": "object", "properties": {"name": {"type": "string"}, "uri": {"type": "string"}}, "required": ["name", "uri"]}, "published": {"type": "string", "format": "date-time"}, "entry": {"type": "array", "items": {"type": "object", "properties": {"id": {"type": "string"}, "videoId": {"type": "string"}, "channelId": {"type": "string"}, "title": {"type": "string"}, "link": {"type": "array", "items": {"type": "object", "properties": {"rel": {"type": "string"}, "href": {"type": "string"}}, "required": ["href", "rel"]}}, "author": {"type": "object", "properties": {"name": {"type": "string"}, "uri": {"type": "string"}}, "required": ["name", "uri"]}, "published": {"type": "string", "format": "date-time"}, "updated": {"type": "string", "format": "date-time"}, "group": {"type": "object", "properties": {"title": {"type": "string"}, "content": {"type": "object", "properties": {"url": {"type": "string"}, "type": {"type": "string"}, "width": {"type": "string"}, "height": {"type": "string"}}, "required": ["height", "type", "url", "width"]}, "thumbnail": {"type": "object", "properties": {"url": {"type": "string"}, "width": {"type": "string"}, "height": {"type": "string"}}, "required": ["height", "url", "width"]}, "description": {"type": "string"}, "community": {"type": "object", "properties": {"starRating": {"type": "object", "properties": {"count": {"type": "string"}, "average": {"type": "string"}, "min": {"type": "string"}, "max": {"type": "string"}}, "required": ["average", "count", "max", "min"]}, "statistics": {"type": "object", "properties": {"views": {"type": "string"}}, "required": ["views"]}}, "required": ["starRating", "statistics"]}}, "required": ["community", "content", "description", "thumbnail", "title"]}}, "required": ["author", "channelId", "group", "id", "link", "published", "title", "updated", "videoId"]}}}, "required": ["author", "channelId", "entry", "id", "link", "published", "title"]}
